{"id":"REC-COMPAT-CAD-009","work_item":"COMPAT-CAD-009","status":"DECIDED","problem":"The immutable CC009 ledger records ARCHITECT_REVIEW -> APPROVED at 2026-09-06T12:08:00Z and APPROVED -> MERGED at 2026-09-06T12:07:25Z. The physical merge is genuine, but the ledger ordering makes the merge precede the recorded approval and triggers both temporal-ordering and decision-order validation failures. No implementation, verification, architecture or evidence requirement is waived.","defects":[{"rule":"temporal-ordering","violation":"precedes-previous","transition":12,"original":{"from":"APPROVED","to":"MERGED","at":"2026-09-06T12:07:25Z","actor":"payswapdotorg","role":"product-owner"},"explanation":"The physical PR #14 merge occurred at 12:07:25Z, while the Architect approval record was written at 12:08:00Z. This is a process-recording order defect; the immutable merge timestamp is preserved."},{"rule":"decisions","violation":"no-prior-approved-decision","state_entry":"MERGED","original":{"from":"APPROVED","to":"MERGED","at":"2026-09-06T12:07:25Z","actor":"payswapdotorg","role":"product-owner"},"explanation":"At the immutable merge timestamp, DEC-002 had not yet been recorded, so the validator correctly reports that the merge entry lacked a prior recorded approved decision. The reconciliation sanctions only this historical recording-order consequence and does not change the decision or merge facts."}],"evidence":[{"id":"EV-013","type":"ci-run","description":"Exact post-merge CI for product merge 066be5fc completed terminal-success across Electron host, Web host and real-engine deterministic suite.","produced_at":"2026-09-06T12:42:00Z","reproducible":true,"reproduction":"GitHub Actions cad-implement-002 run 34032178301.","references":{"workflow_run":"34032178301","commit":"066be5f"}},{"id":"EV-014","type":"inspectable-artifact","description":"Exact-SHA independent black-box browser-agent gate for CC009 on the physical product merge; G5/G7/G8 pass with evidence binding validated by CI.","produced_at":"2026-09-06T12:44:44Z","reproducible":true,"reproduction":"GitHub Actions cc009-browser-gate run 34032178294; artifact 9989550776 sha256:3da64497af13532d080b4eda8eced6163a5454d099976b250ed08d7704015c3f.","references":{"workflow_run":"34032178294","commit":"066be5f","artifact_path":"GitHub Actions artifact 9989550776"}},{"id":"EV-015","type":"reproducible-script","description":"Governance validation run 34032828855 identified the reconcilable CC009 temporal-ordering and decision defects after an intermediate governance bookkeeping update temporarily omitted EV-001 through EV-004.","produced_at":"2026-09-06T12:48:15Z","reproducible":true,"reproduction":"GitHub Actions governance run 34032828855 with artifact 9989608227.","references":{"workflow_run":"34032828855","commit":"31afe9a","artifact_path":"GitHub Actions artifact 9989608227"}}],"acr":"ACR-006","decided_by":"payswapdotorg","role":"architect","decided_at":"2026-09-06T13:37:00Z","rationale":"ACR-006 sanctions only the two historical validator violations caused by event-recording order. The immutable transition facts remain unchanged. Exact product, deterministic and browser verification evidence remains fully subject to normal revision binding and MERGED -> VERIFIED requirements.","remediation":"No implementation rollback or validator weakening. Preserve the historical ledger and this reconciliation overlay permanently; retain the normal verification evidence and successor lifecycle requirements."}